{
  "$schema": "https://json-schema.org/draft/2020-12/schema",
  "$id": "meta.schema.json",
  "type": "object",
  "required": ["id", "name", "medium", "archetype", "canonical_url", "text_provenance", "references", "approvals"],
  "properties": {
    "id":       { "type": "string", "pattern": "^[a-z0-9][a-z0-9-]*$" },
    "name":     { "type": "string", "minLength": 1 },
    "spdx":     { "type": ["string", "null"] },
    "medium":   { "enum": ["software", "media", "hardware", "data"] },
    "archetype":{ "enum": ["permissive", "weak-copyleft", "strong-copyleft", "attribution", "share-alike", "public-domain", "proprietary"] },
    "version":  { "type": ["string", "null"] },
    "year":     { "type": ["integer", "null"] },
    "canonical_url": { "type": "string", "format": "uri" },
    "text_provenance": {
      "type": "object",
      "required": ["source_url", "retrieved_at", "sha256"],
      "properties": {
        "source_url":   { "type": "string", "format": "uri" },
        "retrieved_at": { "type": "string", "format": "date-time" },
        "sha256":       { "type": "string", "pattern": "^[a-f0-9]{64}$" }
      },
      "additionalProperties": false
    },
    "references": {
      "type": "array", "minItems": 1,
      "items": {
        "type": "object",
        "required": ["source", "url", "retrieved_at"],
        "properties": {
          "source":       { "type": "string", "minLength": 1 },
          "url":          { "type": "string", "format": "uri" },
          "retrieved_at": { "type": "string", "format": "date-time" },
          "note":         { "type": "string" }
        },
        "additionalProperties": false
      }
    },
    "approvals": {
      "type": "array",
      "description": "Stewardship-body approval / classification status for this license.",
      "items": {
        "type": "object",
        "required": ["body", "approved", "url", "retrieved_at"],
        "properties": {
          "body":         { "enum": ["OSI", "FSF", "Debian DFSG", "Fedora"] },
          "approved":     { "type": "boolean" },
          "url":          { "type": "string", "format": "uri" },
          "retrieved_at": { "type": "string", "format": "date-time" },
          "note":         { "type": "string" }
        },
        "additionalProperties": false
      }
    }
  },
  "additionalProperties": false
}
